title,time,origin,author,article,latitude,longitude
瑞安市交通运输局开展2017年第一季度交通重点建设项目督查活动,时间：2017-03-21,来源：瑞安市交通运输局,作者：池邦云,  3月21日上午，由瑞安市交通运输局总工郑建州带队督查龙丽温高速文成至瑞安段、S230（57）省道瑞安宁益至龙湖段改建、G322瑞安高楼段抢险救灾通道工程等第一季度工程进展情况。高速办、交建办、仙降街道、马屿镇、平阳坑镇、高楼镇、瑞文公司等10余名代表参加。,19.4206657,-152.6093
苍南县交通运输局开展“铸铁军，打硬仗”军训活动,时间：2017-03-21,来源：苍南县交通运输局,作者：苏科,  3月19日，为响应苍南县三级干部大会上提出的“铸铁军，打硬仗”的口号，着力铸造一支“政治坚定、纪律严明、业务精湛、作风过硬”的“交通铁军”队伍，县交通运输局吹响军训集结号，在苍南中学组织开展为期一天的军事训练活动。该局全体干部职工计260多人参加军训。,19.4206657,-152.6093
省交通运输厅副厅长王寅中率队督查“最多跑一次”工作,时间：2017-03-21,来源：市港航局,作者：陈少渊,  3月21日，以省交通运输厅副厅长王寅中为组长，厅安全处处长李法卫、省机场局副局长于晨辉等一行到市行政审批中心督查交通运输窗口“最多跑一次”工作。,19.4206657,-152.6093
温州交通质监局组织召开《公路工程施工监理规范》宣贯会,时间：2017-03-21,来源：温州市交通工程质量监督局,作者：许张亮,  新版《公路工程施工监理规范》出台，为帮助广大质监人员和监理管理人员更快更好地掌握、理解并应用新规范，2017年3月18日，温州市交通工程质量监督局专题组织召开宣贯会，将新版《公路工程施工监理规范》进行集中全面地宣贯。,19.4206657,-152.6093
104国道乐清超限运输检测站加强宣传源头治超,时间：2017-03-21,来源：温州市公路局,作者：林剑武,  随着气候的转暖，我市各项工程均进入了施工高潮阶段，公路上运砂石车辆逐日增多，“抛、撒、滴、漏”等现象频繁出现，既污染了路面，又对公路路面造成了不同程度的损坏，更为群众行走行车带来极大的安全隐患。,19.4206657,-152.6093
鹿城交通质监站举办“小型农村公路工程质量安全管理”培训班,时间：2017-03-21,来源：温州市交通工程质量监督局,作者：叶丰伟,  为扎实推进鹿城区农村公路联网及改造提升工程建设，进一步加强小型农村公路工程质量安全管理，3月17日，鹿城区交通质监站组织举办培训班，就小型农村公路工程质量安全管理相关内容做集中宣贯培训。参加培训的有藤桥镇、山福镇、公路局相关科室人员，以及今年实施工程建设的8个村委会工程管理人员。,19.4206657,-152.6093
港航执法二大队认真学习贯彻市第十二次党代会精神,时间：2017-03-21,来源：温州市港航局,作者：张延曼,  3月20日，温州市港航管理局执法二大队召开党员专题学习会，深入学习和理解了温州市第十二次党代会的精神实质，领会和把握了五年来全市经济社会发展取得的巨大成就和宝贵经验，以及今后五年全市经济社会发展的奋斗目标、战略举措。,19.4206657,-152.6093
温州市首场网约车驾驶员从业资格考试开考,时间：2017-03-21,来源：温州运管局,作者：金向永,  2017年3月17日上午，备受市民关注的温州市首场网约车驾驶员从业资格考试在温州交通技术学校牛山校区如期举行，温州市运管局吴彦副局长、驾培处陈用银处长、出租处杨国华处长等到考场指导考试工作，首场考试原定人数为100人，实际共84名考生参加，考试合格31人，合格率为36.9%。,19.4206657,-152.6093
乐清举行“诚实守信、优质惠民”3.15活动,时间：2017-03-21,来源：温州运管局,作者：王佩珍,  为深入贯彻落实《关于促进汽车维修业转型升级 提升服务质量的指导意见》有关精神，加快引导乐清市汽车维修业向民生服务业转型，不断满足广大消费者对车辆维修优质化、多样化、个性化需求，全力打造“优质、诚信、便捷、舒适”的车辆维修市场，不断提高机动车维修行业的顾客满意度和社会信誉度，在315服务质量月到来之际，乐清市运管局指导乐清市机动车维修行业协会开展以“诚实守信、优质惠民”为主题的便民服务和优惠维修活动。活动要求各维修企业强化质量管理，打造优质修车环境；规范经营行为，打造诚信修车环境；重视服务关怀，打造舒适修车环境。,19.4206657,-152.6093
瑞安市运管局圆满完成“两会”期间道路运输安保工作,时间：2017-03-21,来源：温州运管局,作者：包游游,  今年“两会”期间，瑞安市运管局多次组织稽查安全科、客运科、辖区中队执法人员，对全市道路运输行业安保工作落实情况进行督查。,19.4206657,-152.6093
乐清港航局迎接省级文明单位复评检查,时间：2017-03-21,来源：市港航管理局,作者：胡程琳,  3月17日下午，乐清市文明办邵国清副主任一行对乐清市港航管理局进行省级文明单位复评检查考核工作。检查组一行通过听取汇报、查看台账、实地考察等方式进行考核。,19.4206657,-152.6093
瓯海区交通局局金剑欣赴交运集团城西公交公司对接相关公交工作,时间：2017-03-20,来源：瓯海区交通局,作者：柳俏,  3月20日，瓯海区交通运输局金剑欣率局有关人员赴交运集团城西公司对接2017年相关公交工作。城西公交公司总经理陈忠义、生产经营部经理阮春隆、区交通局纪检组长黄海凡及相关科室人员参加对接会议。,19.4206657,-152.6093
瑞安市交通运输局召开2017年重点工作部署会议,时间：2017-03-20,来源：瑞安市交通运输局,作者：陈京子,  3月17日，瑞安市交通运输局召开交通系统文明创建、安全生产、平安建设及党风廉政建设等工作部署会议。会议由瑞安市交通运输局副局长季雅主持，局机关全体成员、局属事业单位中层正职以上及局属企业领导班子成员等参加了会议。,19.4206657,-152.6093
瑞安开展飞云江辖区砂石运输船舶联合整治动员会,时间：2017-03-20,来源：瑞安市交通运输局,作者：郑智颖,  3月17日上午，瑞安飞云江辖区砂石运输船舶联合整治动员会在飞云江海事处三楼会议室召开，整治行动由瑞安市港航管理局牵头，与海事处、边防大队、水利局共同开展。各码头、砂石船舶和砂场代表参与会议。 ,19.4206657,-152.6093
瑞安：永峰桥桥台受损 车辆限载通行,时间：2017-03-20,来源：瑞安市交通运输局,作者：陈青化 黄旭明,  3月16日上午，瑞安公路局湖岭公路站工作人员巡查发现，瑞枫线49K+600路段永峰桥桥台（桥面与路面交接缝）处的水泥板块严重受损。出现长10米，宽0.60米，约6个平方米的破损面，其中约0.50平方米的破损口已明显浮动，通过破损口，可直接看到桥底。,19.4206657,-152.6093
鹿城区召开2017年全区交通运输行业安全生产暨一季度安全生产工作例会,时间：2017-03-20,来源：鹿城区交通运输局,作者：孟昭金,  3月17日下午，鹿城区召开2017年全区交通运输行业安全生产、消防安全、综治维稳暨一季度安全生产工作例会。交通运输局党组成员、副局长胡玉飞出席会议，党组成员陈千书及局机关各科室、局属各单位、交通运输行业协会、鹿城物流商会、温鹿交通运输公司等负责人参加会议，会议还邀请了山福镇、七都街道负责管理渡口科室负责人和江心瓯游站负责人。会议由局管理科负责人姜宝生主持。,19.4206657,-152.6093
市交通运输局蒋理江副局长一行调研市铁投集团,时间：2017-03-20,来源：市交通运输局,作者：胡祥斌,  为了加快全市铁路项目的建设进度，完善全市重大交通项目的考核督导，3月17日上午，市交通运输局蒋理江副局长带队赴市铁投集团调研并召开座谈会，铁投集团朱三平总经理、金林副总经理等参加座谈。,19.4206657,-152.6093
瓯海区交通运输局局长金剑欣专题协调企业厂房外立面改造工作,时间：2017-03-20,来源：瓯海区交通局,作者：林欢洋, 3月17日，瓯海区交通运输局局长金剑欣到金丽温高速边嘉利工业公司专题协调企业厂房外立面改造工作，梧田街道、区公路局、嘉利公司有关人员陪同。,19.4206657,-152.6093
瓯海区周金平副区长督查“两路两侧”环境综合整治工作,时间：2017-03-20,来源：瓯海区交通运输局,作者：林欢洋, 2017年3月19日，瓯海区周金平区长到金丽温高速娄桥段、新金温铁路郭溪段、S1线新桥和潘桥段等路段督查指导“两路两侧”环境综合整治工作。区交通运输局局长金剑欣，区公路管理局局长彭朝晖等陪同。,19.4206657,-152.6093
温州市交通工程试验检测公司开展桥梁检测加固技术专题讲座,时间：2017-03-17,来源：温州市交通工程质量监督局,作者：胡梦月,  3月17日，温州市交通工程试验检测有限公司邀请兰州理工大学博士生导师程选生教授，给全体试验检测人员及相关技术人员进行了关于桥梁检测加固技术的授课培训。,19.4206657,-152.6093
温、台两家交通工程试验检测公司互相交流谋发展,时间：2017-03-17,来源：温州市交通工程质量监督局,作者：胡梦月,  3月15日，台州交投集团率下属台州市交通工程检测公司的负责人及相关管理人员一行来到温州市交通工程试验检测公司，交流和探讨工作新思路、新方法。  ,19.4206657,-152.6093
瓯海区交通运输局与交警四大队对接吹台山隧道工程交通信号灯事宜,时间：2017-03-17,来源：瓯海区交通局,作者：池长超,  根据何宗静副书记、金衍光常务副区长对交警四大队的《关于要求事故黑点治理的报告》报告的批示及瓯海交通局对报告的回复意见，3月17日，瓯海区交通运输局与交警四大队对接吹台山隧道工程交通信号灯事宜。,19.4206657,-152.6093
温州市港航管理局机关第四支部开展专题学习会,时间：2017-03-17,来源：市港航局,作者：连家树,  为深入学习贯彻市第十二次党代会精神，进一步统一支部党员干部的思想，3月17日，温州市港航局第四支部在四楼西会议室开展专题学习会。会议由支部书记周友丰主持，专题学习了周江勇书记在中国共产党温州市第十二次代表大会上的报告。,19.4206657,-152.6093
瑞安开展飞云江辖区砂石运输船舶联合整治动员会,时间：2017-03-17,来源：市港航管理局,作者：郑智颖,  3月17日上午，飞云江辖区砂石运输船舶联合整治动员会在飞云江海事处三楼会议室召开，各码头、砂石船舶和砂场代表参与会议。,19.4206657,-152.6093
平阳县港航管理局组织召开2017年度安全生产工作会议,时间：2017-03-17,来源：市港航管理局,作者：肖云蔚,  3月15日下午，平阳县港航管理局组织召开了2017年平阳县港航系统安全生产工作会议。会议总结2016年辖区安全生产工作，部署2017年安全重点工作，县交通局林开杰副局长，各港航企业主要负责人参加。,19.4206657,-152.6093
市交通运输局副局长张银华督查乐清 建制村客车“村村通”和安全生产工作,时间：2017-03-17,来源：乐清市交通运输局,作者：陈穆仙,  3月15日，温州市交通运输局副局长张银华率队赴乐清督查建制村客车“村村通”和安全生产工作。,19.4206657,-152.6093
甬台温公路公司总经理兼党委书记孔德圣到走访经营一线 慰问基层员工,时间：2017-03-16,来源：甬台温公路公司,作者：朱佰敏 叶昌陈海滨 吴利明,3月6日至9日，公司总经理兼党委书记孔德圣在公司常务副总经理温振亚的陪同下，走访全线各收费所、服务区及有关部门。,19.4206657,-152.6093
苍南县交通运输局组织人员参观甬台温高速复线土建工程标准化建设,时间：2017-03-16,来源：苍南县交通运输局,作者：林上璐,  为更好开展104国道苍南段改建工程工地标准化建设工作，进一步宣贯省市交通部门有关标准化工地建设的精神。3月15日，县交通运输局组织104国道苍南段改建工程施工、监理等参建单位人员到甬台温高速复线土建工程参观学习。,19.4206657,-152.6093
温州市港航管理局召开“强责任敢担当，治顽疾优环境”作风建设活动问题征集会,时间：2017-03-16,来源：市港航局,作者：朱朝晖,  为认真贯彻市委、市政府“强责任敢担当，治顽疾优环境”作风建设活动“作风问题大排查”阶段的工作部署，3月16日，温州市港航管理局召开“强责任敢担当，治顽疾优环境”作风建设活动问题征集会。此次会议邀请了水运企业、港口企业、船厂及产品厂等12名代表参加。,19.4206657,-152.6093
平阳县召开2017年全县交通运输工作会议,时间：2017-03-16,来源：平阳县交通运输局,作者：应辉景,  3月16日下午，平阳县2017年全县交通运输工作会议在县府小礼堂召开，县领导陈永光、卢成杭、县府办、县委政法委、县交通运输局等有关部门及各乡镇主要负责人参加了会议。,19.4206657,-152.6093
永嘉瓯北公路管理所清除公路边各类垃圾500余立方,时间：2017-03-16,来源：永嘉县交通运输局,作者：陈康锡 周鹏,  连日来，县公路管理局瓯北公路管理所对辖区G104线公路两侧的多处生活垃圾、建筑垃圾进行清理，共计500余立方。,19.4206657,-152.6093
高速路政大队开展桥下空间整治行动,时间：2017-03-16,来源：温州市公路局,作者：王 洁,  为进一步消除高速公路桥梁通行安全隐患，打造美好路域环境，3月15日下午，温州高速路政大队六中队在副大队长王胜的带领下，联合枫林镇政府、诸永公司业主单位对辖区桥下空间进行专项整治行动。,19.4206657,-152.6093
泰顺全面清除S331桥梁隐患 确保桥梁安全畅通,时间：2017-03-16,来源：温州市公路局,作者：庄孔旭 曾文允,  近日，泰顺县公路局富垟公路管理站对辖区S331省道桥面进去全面清理，以大中型桥梁为重点，逐一排查桥梁安全隐患。加强路桥伸缩缝的养护工作。全面做好桥梁安全管理工作。,19.4206657,-152.6093
市公路局副书记王雨来调研苍南、泰顺公路工作,时间：2017-03-16,来源：温州市公路局,作者：庄孔旭  徐宝定 王晓晓,  3月15日，温州市公路管理局副书记、副局长王雨来携相关处室负责人督查苍南、泰顺公路局公路工作。,19.4206657,-152.6093
鹿城：参加小城镇环境综合整治“车乱开”治理专项行动,时间：2017-03-16,来源：鹿城区交通运输局 温州市公路局,作者：林炯,  2017年3月15日，鹿城区公路管理局戴宅公路管理所与支岙公路管理所参加山福镇、藤桥镇组织的小城镇环境综合整治“车乱开”治理专项行动。山福镇联合执法一中队、交警一大队五中队、各网格等部门单位联合参加此次活动。,19.4206657,-152.6093
温州龙港大桥改建项目首片中横梁吊装完成,时间：2017-03-16,来源：温州市交通工程质量监督局,作者：贾述荣,"  2017年3月15日中午，中铁上海工程局集团龙港大桥项目全体员工克服潮汐水位不稳定、江面风速大给吊装工作带来安全风险高等不利因素,经过5个小时的连续作业,顺利完成了龙港大桥首片中横梁吊装。",19.4206657,-152.6093
温州瓯海区天长岭隧道复线及接线改建工程电缆管线工程量清单预算及招标文件通过审查,时间：2017-03-16,来源：瓯海区交通运输局 温州市交通工程质量监督局,作者：黄锦樘,  2017年3月15日下午，瓯海区交通运输局组织开展天长岭隧道复线及接线改建工程电缆管线工程量清单预算及招标文件的审查。,19.4206657,-152.6093
洞头运管积极参与“放心消费在洞头”3.15宣传咨询活动,时间：2017-03-16,来源：温州运管局,作者：李小刚,  3月15日上午，洞头区运管局选派业务骨干参加由洞头区消费者权益保护委员会举办的2017年“315国际消费者权益保护日”现场宣传活动。,19.4206657,-152.6093
瑞安市运管局提前布置2015年度瑞安市出租汽车油补发放工作,时间：2017-03-16,来源：瑞安市交通运输局 温州运管局,作者：项婷婷,  3月14日下午，瑞安市运管局出租车管理科根据《瑞安市交通运输局、市财政局关于发放2015年度农村客运、出租车、水路客运等行业成品油价格补助的通知》，组织召开2015年度出租汽车财政补贴资金发放工作部署会，全市9家出租车企业负责人及有关人员参加了会议。,19.4206657,-152.6093
乐清港航与海事、边防部门开展联合巡查行动,时间：2017-03-16,来源：市港航管理局,作者：杨乐斌,  为确保乐清湾港区健康、平稳发展，3月15日上午，乐清港航局、乐清湾海事处、蒲岐边防所三方开展联合巡查行动，乐清湾港航所副所长胡袭、乐清湾海事处办事处主任胡宏光 、蒲岐边防所所长罗崇建等8人参与行动。,19.4206657,-152.6093
市港航局副局长夏鸣来执法二大队指导审批许可工作,时间：2017-03-16,来源：市港航管理局,作者：林海亮,  3月16日上午，市港航局副局长夏鸣带领市局审批处相关人员来港航执法二大队指导审批许可工作。,19.4206657,-152.6093
322国道生命防护工程文成段全面完工,时间：2017-03-16,来源：温州市公路局,作者：胡悦斌,  3月15日，文成县公路管理局组织了县交警大队、县交通质监站及整个工程设计、施工、监理团队的参建人员，对322国道生命防护工程文成段进行预验收，标志着该工程全面完工。,19.4206657,-152.6093
洞头港航弘扬志愿服务精神 助力花园村庄建设,时间：2017-03-15,来源：市港航局,作者：林江,  为积极响应洞头“花园村庄”建设工作，3月15日，洞头区港航管理局志愿服务队积极参与东岙顶村环境卫生大整治活动。,19.4206657,-152.6093
洞头运管积极参与“放心消费在洞头”3.15宣传咨询活动,时间：2017-03-15,来源：洞头区交通运输局,作者：李小刚,  3月15日上午，洞头区运管局选派业务骨干参加由洞头区消费者权益保护委员会举办的2017年“315国际消费者权益保护日”现场宣传活动。,19.4206657,-152.6093
市交运学习宣贯市第十二次党代会精神,时间：2017-03-15,来源：市交运集团,作者：赵远,  近日，市交运集团召开学习宣贯温州市第十二次党代会精神干部大会，旨在准确把握、深刻领会市党代会精神，切实把思想和认识统一到市党代会精神上来，通过抢抓发展机遇，凝聚转型动力，将精神全面贯彻到生产实践中去。集团领导班子、各单位（部室）主要负责人参会。,19.4206657,-152.6093
市公路局党委会专题研究“强责任敢担当，治顽疾优环境”作风建设活动,时间：2017-03-15,来源：温州市公路局,作者：卜寒阳,  为贯彻落实市委、市政府开展作风建设的重大决策部署，市公路局日前召开党委会，专题学习上级关于作风建设有关精神，研究讨论并通过市公路局关于开展“强责任敢担当，治顽疾优环境”作风建设活动的实施方案。,19.4206657,-152.6093
瓯海公路局与相关部门协调下沈线路面空鼓问题,时间：2017-03-15,来源：温州市公路局,作者：陈逊谦,  3月14日，瓯海区公路管理局联合丽岙街道以及下沈线整治工程施工、监理、设计等单位就路面空鼓问题开展现场对接协调。,19.4206657,-152.6093
高速路政大队召开2017年度工作会议,时间：2017-03-15,来源：温州市公路局,作者：张钟开,  3月14日，温州高速路政大队召开2017年度工作会议，会议由高速路政大队副书记胡志平主持，大队全体人员参加，市公路局党委书记、局长连真毅，党员委员、副局长王航宇出席。,19.4206657,-152.6093
龙湾区交通运输局督查重点交通工程建设,时间：2017-03-15,来源：龙湾区交通运输局,作者：曹成龙,  3月14日下午，龙湾区交通运输局局长孙方忠带队，在区交建办和施工单位负责人陪同下，先后来到330国道龙湾段和瓯海大道东延及枢纽集散系统立交以北段施工现场，督查建设进度。,19.4206657,-152.6093
乐清港航局开展“学雷锋义务捡垃圾环保公益活动”,时间：2017-03-15,来源：市港航管理局,作者：胡程琳,  为进一步弘扬中华民族传统美德，推动学雷锋活动的深入持续开展，3月14日，乐清市港航管理局组织志愿者开展“学雷锋义务捡垃圾环保公益活动”。,19.4206657,-152.6093
瓯海交通局切实保障建制村客车“村村通”工作,时间：2017-03-15,来源：瓯海区交通运输局,作者：柳俏,  为切实做好全市建制村客车“村村通”工作，3月14日区交通运输局纪检组长黄海凡带队赴泽雅镇开展调查摸底。,19.4206657,-152.6093
加快农村公路改造提升 全面拓宽美丽乡村之路,时间：2017-03-14,来源：温州市公路局,作者：郑鹏,  公路是社会的重要基础设施，对推动经济社会全面、协调、可持续发展，构建和 谐社会，方便群众生产生活发挥着极其重要的作用。近日，洞头区公路管理局局长林宣志率领公路养护技术人员前往大门镇枫树坑至龟岩路段现场勘探，今年该局农村公路改造提升预计建设15公里，投入800多万元。,19.4206657,-152.6093
拆除30多年的老站房 排除公路用房无隐患,时间：2017-03-14,来源：温州市公路局,作者：叶迈峰 黄光锋,  永嘉公路管理局结合《深入开展永嘉公路行业安全生产大检查遏制重特大事故工作方案》，对全县现有的老站房进行安全隐患管理处置行动。3月14日上午，该局对瓯北塔下路30多年前修建的老料场管理房进行人员腾空，随后动用大型挖机对该老料场用房进行全面拆除，挖机轻轻一碰，老房墙壁大片坍塌让人心惊。在现场观看的附近群众纷纷议论还好已经开拆，拆的好！不然这些已经开裂墙壁，遇台风暴雨季节，很容易坍塌真的很危险。工作人员经过3个多小时的紧张拆除，300多平方米的老用房终于清理完毕，消除了安全隐患。,19.4206657,-152.6093
永嘉县石埠至西垟公路工程第二合同段质量检测方案评审会召开,时间：2017-03-14,来源：永嘉县交通运输局 温州市交通工程质量监督局,作者：麻尘铄,  3月13日下午，永嘉县石埠至西垟公路工程第二合同段质量检测方案评审会在温州信达交通工程试验检测有限公司四楼会议室召开。永嘉交通监督站、建设、检测等单位代表及特邀专家参加了本次会议。,19.4206657,-152.6093
温州市大门大桥二期工程顺利交工,时间：2017-03-14,来源：乐清市交通运输局  市交通工程质量监督局,作者：朱湘铭,  3月13日，温州市大门大桥二期工程交工验收会议在乐清市交通运输局召开，参加交工验收会议的有乐清市交通运输局、市财政局、市审计局、市交通工程建设办公室、市公路管理局、市交通质监站、市交警大队、沿线街道及建设施工设计监理等相关单位的代表。,19.4206657,-152.6093
温州交通质监局学习贯彻市第十二次党代会精神,时间：2017-03-14,来源：温州市交通工程质量监督局,作者：林忠辉,  3月13日下午，温州市交通工程质量监督局召开全体干部职工会议，学习贯彻市第十二次党代会精神，对今年的党风廉政建设工作再部署。会议由支部书记、局长周建华主持，局机关全体干部职工参加。,19.4206657,-152.6093
温州市运管局召开全市运管系统党风廉政暨作风建设工作会议,时间：2017-03-14,来源：温州运管局,作者：马术华,  3月13日下午，全市运管系统召开党风廉政暨作风建设工作会议，局领导班子成员、全体干部职工和各县（市、区）运管局主要负责人、纪检监察分管领导、纪检监察负责人共120余人参加会议。,19.4206657,-152.6093
温州市运管局召开全市运管系统安全年度工作会议,时间：2017-03-14,来源：温州运管局,作者：陈彩选,  3月13日下午，温州市运管局召开全市运管系统2017年度安全工作会议。局各业务处室、大队负责人和安全员，各县（市、区）运管局分管安全领导、安全科长、安全员参加了会议。吴光福局长主持会议并作重要讲话。,19.4206657,-152.6093
