title,time,origin,author,article,latitude,longitude
龙丽温高速文瑞段峃口隧道率先实现贯通,时间：2017-06-20,来源：温州市公路局,作者： 胡悦斌, 6月16日下午，龙丽温高速文瑞段峃口隧道最后一次爆破，实现了峃口隧道的贯通，这也是龙丽温高速文段段工程建设中第一个实现贯通的隧道。 现场，随着一声炮响，峃口隧道右洞的最后三米被打通，率先完成贯通任务。峃口隧道全长839米，从去年8月首次爆破以来，随着一日接一日的进洞作业，历时9个多月的时间，超前完成了任务，实现了贯通。 龙丽温高速文瑞段一标段项目经理张书峰表示，该工程的顺利贯通为龙丽温高速公路后期创作一个良好的基础，下一步将进一步抓紧左洞的施工，左洞预计在7月中旬实现贯通，包括电力工排水工和路面铺砖都会陆陆续续完工。峃口隧道东连峃口大桥串联九溪隧道，西连泗溪Ⅱ号桥串联尽顶屋隧道，它的贯通将大大提高龙丽温高速文成段的施工进度。此外，除了峃口隧道外，龙丽温高速文成段一标段工程还包括尽顶屋隧道、九溪隧道、泗溪二号桥以及峃口大桥。 目前，龙丽温高速公路文成段施工进展顺利，隧洞累计进洞5个多公里，其中，尽顶屋隧道目前进洞600多米，预计春节前实现贯通，九溪隧道进洞420米，预计2018年4月份实现贯通。四座桥梁的桩机都在施工，在汛期来临前已经完成了所有涉溪的桩基工程，目前已经完成桩基40根，桥台7座。完成总工程量的25%，在时间节点上，项目的建设都超前完成。,19.4206657,-152.6093
景宁至文成段项目投资建设合作协议签约仪式在丽水举行,时间：2017-06-20,来源：温州市公路局,作者： 胡悦斌, 近日，龙丽温高速公路景宁至文成段项目投资建设合作协议签约仪式在丽水市行政中心举行，这也标志着龙丽温高速公路景宁至文成段项目即将从理想转化为现实。 景宁至文成段起点顺接云和至景宁段终点，经过景宁县城，往东翻越洞宫山至终点文成县樟台，接文成至泰顺段进而与福建的福寿高速公路相顺接。龙丽温高速项目全长约40.8公里，其中文成段12.1公里；项目总投资约74.14亿元，其中文成段投资约21.96亿元。整条龙丽温高速预计2022年建成通车。该项目按双向四车道高速公路标准建设，路基宽24.5米，设计速度为80公里/小时，建成通车后，文成到温州的车程将从原来的1.5小时缩短至1小时左右。 目前，文泰项目初步设计于2016年12月28日报交通部，于2017年4月1日获批。施工图外业调查于2017年1月开始，现已完成；外业测量于2月开始，4月10日完成；施工图详细勘探已完成，计划7月份完成施工图设计。在土地报批工作方面，已完成相关的权属调查认定、土地规划许可、永农调整、粮食功能区调整、标农置换、建设用地指标申请、国有土地回收、安置地的落实、一书四方案确定等相关工作，林业已完成县级审查报省林业厅审查。目前涉及24个行政村的土地征收村民代表大会和征地协议签订已开始，预计6月18日前完成，争取7月10日前完成县级审查（市政府要求是7月15日前）并组件上报市国土局。 项目建成后，将增加我县通往温州、杭州、福建等地的新通道，成为沟通连接长三角经济圈和海峡西岸经济区的关键段高速公路，补齐我县交通运输发展短板，促使我县经济社会的发展。,19.4206657,-152.6093
乐清市交通运输系统召开第二季度党建暨党风廉政建设工作会议,时间：2017-06-20,来源：乐清市交通运输局,作者：陈穆仙, 6月19日，乐清市交通运输局召开第二季度党建暨党风廉政建设工作会议，乐清市交通运输局党委副书记张立中、驻交通运输局纪检组组长出席会议。 在听取了系统各支部负责人汇报前一阶段党建暨党风廉政建设工作情况后，机关党工委专职副书记邵芦峰对下一步交通运输系统党建和党风廉政建设工作进行了部署。 李永奇组长针对交通运输系统党建和党风廉政建设工作提出要求：工作例会应注重实效；从真抓、真管上下功夫；加大督查和检查的力度；加强谈心谈话；要摸排党风廉政风险防控情况。 张立中副书记表示，交通运输系统党建和党风廉政工作要围绕中心、推进工作，规定工作做到位、自选动作求创新，各支部要突出各行业的特色，要结合本单位、本行业、本企业的实际做好下一步工作，贯彻落实好李永奇组长的五点要求，把党建工作和推进发展、保障安全结合起来。,19.4206657,-152.6093
泰顺县召开建制村客车村村通工作督查汇报会,时间：2017-06-20,来源：泰顺县交通运输局,作者：董海红," 6月16日下午，泰顺县吴曙光副县长召集县直相关部门及14个乡镇负责人,召开建制村客车村村通工作督查汇报会，由县府办陶碎勇副主任主持。  会上，泰顺县交通运输局就当前村村通工作进展情况、存在的问题及下一步需要完成的主要工作做了汇报。14个乡镇及县财政局、县安监局、县交警大队等有相关部门作了发言。 最后，吴曙光副县长就如何推进下一步工作提出了四点意见。一要严明责任、彰显民生，要把村村通工作看做是一项政治任务，要看到村村工作的重要性、艰巨性与紧迫性，明确年底前必须要全部通客车。二要明确任务、合理推进，明确完成各项工程的时间节点，要紧盯目标，倒排时间，落实责任人，全力抓好工作推进，要每周一督查、每月一通报，要以背水一战、破釜沉舟的决心，落实超常规的工作举措，逐个村、逐个路段抓好工作的推进。三要突出重点、强化措施，乡镇要把握重点，制定合理方案，确保工程质量、实现安全通车。四要加强管理、确保完成，切实加强领导，乡镇“一把手”要亲自抓，要强化督查考核，对工作推进不力的乡镇给予通报批评和扣分。",19.4206657,-152.6093
温州市交通运输局董庆华局长调研大物流发展,时间：2017-06-20,来源：温州市运管局,作者：李阳, 2017年6月16日下午，温州市交通运输局局长、党委书记董庆华一行在市道路运输管理局副局长姜刚义、陈代庆等陪同下，对快递、普通货运等物流行业开展调研。 董庆华局长首先实地查看了韵达分拨中心、东风物流甩挂运输操作平台和鹿富城市配送中心，详细了解了快递分拨流程、甩挂运输线路、城市配送运行情况。 随后，召集邮政、运管等有关单位和温州传化公路港、瓯海物流信息中心、温州鹿富物流有限公司、温州东风物流有限公司等物流龙头企业召开座谈会。董庆华局长听取了物流、快递等相关单位、企业负责人的汇报，并就甩挂运输、城市配送、无车承运人、物流信息化建设等方面进行了侧重询问和探讨。 董庆华局长充分肯定了物流发展工作。他指出，物流是国民经济的基础性行业，是朝阳产业更是民生工程，物流行业要加快发展，为巩固提升温州“铁三角”地位，树立标杆。 董庆华局长还对物流行业目前存在的问题、困难进行了科学的分析和探讨，并对下一步工作提出以下几点要求：一是降低物流成本。发挥温州机场、海港、高速、铁路立体交通的优势，大力发展“海陆空”立体物流，提高物流信息化水平、丰富物流形式，降低物流成本。二是确保物流安全。企业要进一步落实安全生产主体责任，严格执行上级有关安全工作文件精神，切实做好党的十九大、建军九十周年等重点时段安全生产工作。三是加强行业扶持。主管部门要发挥监管职能，制定和实施行业发展规划、产业政策，打击违法违规行为。四是发挥行业协会作用。搭建部门与企业间的沟通桥梁和联系纽带，整合物流行业资源，形成共谋、共管、共享的格局。,19.4206657,-152.6093
省运管局叶卫军副局长督导温州村村通工作,时间：2017-06-20,来源：温州市运管局,作者：潘繁荣, 6月15日至16日，省运管局叶卫军副局长率领省局调研组，督查指导温州建制村客车村村通工作。 省局调研组首先到平阳凤卧镇，实地了解省内首条出租车通达行政村试点线路的运行情况，随后在市运管局召开全市建制村客车村村通工作座谈会。座谈会上，县（市）运管局、市公路局和市运管局负责人分别汇报了村村通工作具体推进情况，市交通运输局副局长张银华汇报了前阶段全市村村通工作做法和成效，并围绕“安全通、抓紧通、真正通、长久通”的要求，提出下一步工作重点和保障举措。叶卫军副局长充分肯定温州村村通工作力度，强调要把握时间节点，全面摸清底数，细化通达方案，确保年底前完成全市建制村客车村村通工作任务。 调研期间，叶卫军副局长一行还听取征求客运企业对推进客运行业转型升级相关意见建议。,19.4206657,-152.6093
苍南县郑建忠县长组织召开“村村通”工作推进会,时间：2017-06-19,来源：苍南县交通运输局,作者： 曾逸, 6月15日晚，为全面落实省委、省政府提出2017年全省实现“村村通客车”的总体目标和省交通运输厅《关于下达全省建制村客车“村村通”专项行动工作目标任务的通知》（浙交办﹝2017﹞84号）工作要求，以及6月12日陈建民副市长在全市建制村客车“村村通”工作督查汇报会上提出的重要指示，苍南县县长郑建忠组织有关部门单位负责人及乡镇一把手，紧急召开“村村通”工程建设工作推进会，并代表县政府与各乡镇签订“村村通”工作目标考核责任书。,19.4206657,-152.6093
苍南县交通运输局召开2017年人大建议、政协提案面商会,时间：2017-06-19,来源： 苍南县交通运输局,作者： 苏科, 6月16日上午，苍南县交通运输局组织召开人大代表建议、政协委员提案办理工作面商会，会议邀请了人大建议、政协提案的领衔代表到会面商。县交通运输局班子成员及相关科室负责人出席会议。,19.4206657,-152.6093
连续降雨致塌方 瑞安公路管理局及时抢险保畅通,时间：2017-06-19,来源：瑞安市交通运输局,作者：陈青化 钱乐乐, 近日，受连日雨天影响，瑞安公路发生多处坍塌，瑞安公路管理局全体职工严阵以待，第一时间奔赴现场及时抢险，排除隐患，确保辖区公路安全畅通。 6月16日上午，瑞安高楼段国道322线K34+40m、K39+390m路段，以及马屿段京屿线焦浦村K16路段，分别发生较大面积的山体塌方，经雨水冲刷造成路面泥石流。事故发生后，瑞安公路路面抢修人员第一时间赶到现场进行交通管制，及时设置警戒，清除障碍。现场发现除了堆积的大量石块，不少泥土树枝也一同滑落在地。由于抢通及时，现场没有造成交通中断。经抢险人员冒雨连续作战，截至下午15时许，路面抢修完毕，及时消除交通安全隐患，恢复通行。 雨季，瑞安公路局工作人员将切实加大全市公路巡查力度，一旦发生险情，第一时间积极应对，确保路面畅通。同时，公路管理局提醒广大人民群众雨天出行，小心驾驶，以免发生险情。,19.4206657,-152.6093
乐清市交通运输系统召开安全生产专题培训会议,时间：2017-06-19,来源：乐清市交通运输局,作者：林旭欧, 为贯彻落实国家《安全生产法》，加强安全生产的法律、法规和安全知识的宣传教育，提高安全生产意识，6月16日上午，乐清市交通运输局召开全市安全生产专题培训会议，共有100多名交通系统干部、企业负责人、安全管理员及相关科室参会。市交通运输局副局长徐宽宝主持会议，温州安监局刘海峰处长做专题辅导。 培训会上，刘海峰处长先从物权到人权的转变，强调生命健康至上的理念，他还对红线、法治、责任、警醒、治本、创新等概念进行一一讲解，并结合相关事故案例，对当前企业管理中存在的问题进行了深入细致的分析。最后，刘处长重点讲述了关于全面推进安全生产领域改革发展的相关问题。 此次培训内容丰富、针对性强，参培人员受益匪浅，对交通运输系统安全生产工作的重要性有了更深的认识和理解。,19.4206657,-152.6093
鹿城区交通运输系统开展“安全生产月”宣传咨询日活动,时间：2017-06-16,来源：鹿城区交通运输局,作者：徐伊梦、叶建云、徐素微, 为深入开展第16个全国“安全生产月”活动，增强全民安全生产意识，推动全区交通运输行业安全生产形势持续稳定好转，6月16日，鹿城区交通运输系统根据《2017年鹿城区“安全生产月”和“安全生产万里行”活动方案》有关要求，积极响应区安委办号召，在松台街道开展以“全面落实企业安全生产主体责任”为主题的“安全生产月”宣传咨询日活动。,19.4206657,-152.6093
台湾乐清乡亲返乡考察团参观乐清湾港区,时间：2017-06-16,来源：市港航管理局,作者：郭程益, 6月15日上午，台湾乐清乡亲返乡考察团一行26人到乐清湾港区开展叙亲情觅商机活动。乐清市委常委、统战部长赵明皓陪同考察。,19.4206657,-152.6093
瑞安市交通运输局开展 “安全生产月”宣传咨询日活动,时间：2017-06-16,来源：瑞安市交通运输局,作者：黄玉旸, 今年6月是第十六个全国“安全生产月”，为全面落实企业安全生产主体责任，6月16日上午，市安委办在莘兴公园组织开展了“安全生产月”宣传咨询日和安全“七进”活动，市交通运输局积极响应，组织全系统公路局、港航局、运管局等单位参加。,19.4206657,-152.6093
温州市交通运输局召开运管工作务虚会,时间：2017-06-16,来源：温州市运管局,作者：董光宽, 6月15日下午，温州市交通运输局在市运管局七楼会议室召开运管2017年半年度工作务虚会，市交通运输局领导、相关处室负责人和市运管局领导班子、中层干部等39人参加会议。市交通运输局局长董庆华主持会议。 会上，温州市运管局中层干部围绕半年来部门工作实际作了重点汇报，班子领导结合条线业务讲亮点、谈思路、谋举措、提建议。党委委员、副局长姜刚义作总结发言。姜刚义副局长指出，上半年在市交通运输局的坚强领导和同志们的团结合作下，运管克难攻坚、扎实工作，强队伍打造运管铁军，攻难点强势推进“村村通”，破堵点畅通网约车许可，惠民生公交优先发展，优服务落实“最多跑一次”，促转型物流降本增效，推创新驾培维修推广新模式，强监管保障市场平稳有序，各项任务得到了有力推进。下半年，运管将坚持以目标任务、民生需求和问题短板为导向，聚焦点、抓重点、破难点，在城乡客运一体化、货运物流降本增效、出租车健康发展、公交优先发展、服务能力提升、规范市场秩序、转变监管方式、信用体系建设、安全监管、铁军品牌建设等十方面精准发力，紧盯目标、卯足干劲、力补短板，争取交出各方满意的答卷。 温州市交通运输局沈伟卿副局长就人事、党风廉政建设工作提出指导意见，张银华副局长对公交、客运、安全、维稳、市场整治、信用建设、“万人评议”等分管工作作了部署安排。 温州市交通运输局局长董庆华发表重要讲话。董庆华局长表示，今天的务虚会开得很好，运管创新很多、思路很清，大交通观念很强，许多工作都走在前列，今年以来的成绩值得充分肯定。他强调，运管接下去要重点抓好几项工作：一是农村客运村村通。在加快推广成熟通车模式的基础上，对开通车型、营运方式、政府补贴、考评机制等方面进行深入研究，不仅要“村村通”，更要“持久通”。二是公交优先发展。要抓住省、市领导大力发展公共交通的有利契机，加快推动公交成网成线。发挥BRT补充性、过渡性作用，有效衔接起轨道、地铁等交通方式，同时发展好常规公交、社区巴士，推进公交一体化发展，建起“大动脉”和“微循环”，真正做到城市交通外快内畅。三是出租车管理。坚持以人民为中心发展好出租车行业，传统巡游车和网约车要相互融合，既要推动改革又要和谐稳定。四是切实抓好安全生产。五是认真开展“万人评议”，运管要做好方方面面的分析研究。六是落实好“最多跑一次”改革，做好“互联网+服务”文章。 会议最后，董庆华局长对运管队伍建设提了六点希望和要求，勉励大家努力拼搏：一要有事业心、责任心；二要敢担当、善作为；三要爱学习、会创新；四要讲规矩；五要团结合作；六要加强党风廉政建设。,19.4206657,-152.6093
苍南县运管局召开规范道路旅客运输及汽车租赁行业管理工作会议,时间：2017-06-16,来源：温州市运管局,作者： 陈志刚, 6月14日下午，苍南县运管局召开道路旅客运输工作会议和全县汽车租赁行业规范管理工作会议，各运管所、稽查队、审批科负责人和各客运、出租企业经理、安全员50多人与会。 客运科陈小平科长首先就第二季度道路旅客运输安全形势，“安全生产月”工作部署，运输企业安全监管考核要求，油补发放，文明程度测评小广告整治等方面进行了通报和部署。之后由出租科陈志刚副科长传达进一步加强出租车规范经营整治工作和规范汽车租赁行业管理工作的文件精神，并介绍了租赁车、网约车的办理流程。会上，各运管所也对辖区汽车租赁工作的意见和建议。 最后，戚观顺副局长再次强调道路旅客运输安全工作的重要性，并提出了四点要求:一要夯实基础，消除安全隐患；二要及时完善安全基本台账；三要落实责任，加强安全监管；四要加强督查，完善长效管理机制。,19.4206657,-152.6093
市港航局局长林兴奇到大队开展安全检查工作,时间：2017-06-16,来源：市港航局,作者： 张延曼 郭熙熙, 为确保水上交通安全形势的稳定，市港航局印发了《关于开展2017年温州市港航系统“安全生产月”和“安全生产万里行”活动的通知》，为确保工作落实，市局成立七个督查组开展港航系统行业安全督查活动，6月15日，由市港航局局长林兴奇带队的第一督查组分别到执法一大队、执法二大队开展安全检查工作。 督查组一行与大队执法人员先后来到江心屿轮渡码头、渣土码头进行实地查看，随后集中会议室开展工作汇报、检查台账，共同探讨疑难问题。 督查组对瓯江渔船碍航联合整治、瓯江采砂管理轮值执法、涉航工程事中事后监管等特色工作以及渣土码头管理等工作给予肯定，并强调安全生产工作是重中之重，是首要任务。一是一般的工作程序必须到位，对专项工作要有特色；二是要结合大队实际，突出工作重点，包括危货码头专项整治、水运企业的经营资质管理、渡口安全等；三是要完善安全例会不到位的不足，一季度至少要召集一次辖区企业负责人部署安全工作，打通“最后一公里”。同时也提出了四点建议：一要加快推进危货信息化管理，二要对码头、水运企业实施网格化管理，三要建立辖区安全生产隐患库并予以公告，定期整改，四要实行闭环管理。 最后，林兴奇局长指出，安全检查责任重于泰山，要抓紧抓严，还要抓出品牌，发现疑难问题要及时与业务部门做好沟通，善于总结经验。在队伍建设方面，要严明纪律，加强作风建设，塑造基层执法队伍的优良形象。,19.4206657,-152.6093
文成县开展2017年三防应急救援暨平安维稳联合演练活动,时间：2017-06-16,来源：文成县交通运输局,作者：蔡昌前, 6月15日，文成县2017年三防应急救援暨平安维稳联合演练活动在县旅游集散中心举行。参加演练人员有文成县运管局、8家客运企业、1家危货企业和7家汽车维修企业。在演练活动正式开始前，全体参演客车驾驶员进行了“五不、一确保”为重点内容的宣誓誓言，旨在进一步提升驾驶员的安全意识，规范行车操作行为，确保车辆安全行驶。随后，邀请了文成县红十字会主任来演示“心肺复苏”的急救方法，引导参演人员能从思想上认识到学会和掌握急救方法这一安全技能的重要性。,19.4206657,-152.6093
温州市运管局“最多跑一次”放大招：原先跑6趟 现在跑1趟,时间：2017-06-16,来源：温州市运管局,作者：胡炎桢, 为了进一步深化温州运管行政审批制度改革，近日，温州市运管局进行了从业人员资格认定流程再造。改革后的从业人员资格认定事项的办理，将实现网上办理和现场申请相结合，大大节省办事时间，提升办事效率。 根据相关规定，申请办理从业资格证的驾驶人员，原先从申请报名到拿到证件，需要多次来回去窗口、车管所及培训学校，次数多达6趟。为方便群众办事，温州市运管局转换思维，创新服务，重新打造了道路运输驾驶员申报流程。 经过改革后，持有温州驾驶证的申请人，可以直接前往温州市运管局审批处驻培训学校窗口报名，原需要提供车管部门的证明由培训学校定期前往车管所开具证明。原流程中的6个申请步骤被缩减为1步，申请人只需进行网上申请并前往培训学校报名学习即可，将网络申请和现场办理相结合，申请网上审批，证件快递送达，真正意义上实现“最多跑一次”。,19.4206657,-152.6093
温州市运管局授予翁士红“温州市道路运输系统最美司机”称号,时间：2017-06-16,来源：温州市运管局,作者：胡炎桢, 温州市交通局董庆华局长向翁士红颁发“最美司机”荣誉证书。 近日，一位拾金不昧的“温州好的哥”翁士红在社会上引起了很大的反响。6月15日，在温州市运管局一楼大厅内，温州市交通局董庆华局长为翁士红颁发了温州市道路运输系统“最美司机”荣誉证书。 6月10日，的哥翁士红像往常一样接搭档的班。他整理后排座椅的时候，发现了一个背包，包内放着满满两袋一百元人民币，还有一个Ipad和一个装了钞票的皮夹。他立马拉上背包拉链，带着包将车子开到了最近的水心派出所，把包交给了民警。此时，丢包的乘客王先生正着急忙慌地向运管求助。原来，当天凌晨，喝了不少酒的王先生打了翁士红搭档的车，下车时不慎将背包遗漏在车上。根据王先生提供的车牌号，运管部门帮助王先生联系上了出租车的车主伍衷亮。伍衷亮马上联系了翁士红，才知道翁士红已经将背包送到了派出所。得知包被送到派出所，王先生赶紧前去领回钱物。经过核对，包里的12万元现金一分都没少。 有网友将翁士红的善举发到了网上，引起了强烈反响。网友们纷纷评论“满满的正能量，在这个物欲横流，金钱至上的浮夸社会，能拾金不昧，值得表扬！值得学习！”，并称赞翁士红为“温州好的哥”。 为大力宣传先进模范事迹，弘扬行业正气，经研究，温州市运管局决定对翁士红拾金不昧的行为予以通报表彰并给予现金奖励，对和翁士红搭档的夜班驾驶员伍忠亮助人为乐的行为予以通报表彰，另外，对翁士红、伍忠亮的出租车驾驶员信誉考核给予加分，授予翁士红温州市道路运输系统“最美司机”称号。 温州市运管局希望全市出租车从业人员要以先进为榜样，做到助人为乐、救死扶伤、爱岗敬业、热情服务，为树立行业新风貌做出贡献。,19.4206657,-152.6093
瑞安市交通运输局扎实推进“两学一做”学习教育常态化制度化工作,时间：2017-06-16,来源：瑞安市交通运输局,作者：黄益元, 为推进“两学一做”学习教育常态化制度化工作，切实让党员在思想上经历一次“洗礼”，在党性上接受一次“体检”，6月14日，瑞安市交通运输局机关党委在市长运公司三楼会议室举办专题学习会，邀请温州市委党委副校长、知名教授蒋儒标作《加强党的建设》为主题的辅导报告。全系统23个党（总）支部共400多名党员分上、下午两场聆听了报告，局党委委员、副局长黄益元主持会议。,19.4206657,-152.6093
