title,time,origin,author,article,latitude,longitude
瑞安湖岭镇美丽公路工程路基爆破安全施工方案通过审查,时间：2017-09-26,来源：温州市交通工程质量监督局 瑞安市交通运输局,作者： 柯海涵, 9月24日，瑞安湖岭镇美丽公路创建工程路基爆破安全专项施工方案顺利通过专家审查，瑞安市湖岭镇人民政府，瑞安市交通工程建设质量监督站，温州市路桥设计所，监理、施工等单位代表及五位特邀专家参加了会议。,19.4206657,-152.6093
市公路局组织召开文成县应急指挥平台建设方案论证评审会,时间：2017-09-26,来源： 温州市公路局,作者：王罗," 9月22日下午, 市公路局在应急中心会议室组织召开文成县公路应急指挥平台建设方案论证评审会。会议有温州市交通运输局、文成县经信局、文成县公路局、宁波赛迪信息技术有限公司和市公路局各业务处室等相关单位人员参加，并特邀市交通运输局信息中心周理中、温州大学黄学平教授等专家到会指导。 与会专家和代表认真听取了相关单位的汇报，审阅了有关文件，并进行了充分的分析和讨论，对方案进行评估并提出意见和建议。与会人员认为，文成县公路应急指挥平台的建设与应用有助于推动公路应急指挥管理转型升级，项目的建设是必要的。建设方案基本可行，但仍需综合考虑多方因素进行优化完善。 最后，陈亮总工指出文成应急平台建设要做精品示范工程，方案编制要充分体现公路管理职责要求，重视与社会公众的交互联动，提前布局外场监控设置，适当考虑后续服务应用经费投入。",19.4206657,-152.6093
文成玉壶镇打造文成县第一条陶瓷颗粒彩色路面,时间：2017-09-26,来源：温州市公路局,作者：胡悦斌, 近日，随着一群“城市美容师”在冰心街用他们的“画笔”画出文成县第一条陶瓷颗粒彩色骑行道，文成县中国美丽乡村玉泉侨情枫彩带玉壶镇一期工程村庄道路改造正式开工。 为迎接世界文成人大会的到来，以快发展为引擎推动慢生活，给归国华侨展示不一样的侨韵慢城。施工队连夜进场画线，清晨进场施工，放弃午休时间顶着烈日、马不停蹄摊铺路面，目前已完成冰心街和沿溪路各1500平方的彩色路面铺设。同时在建城区道路标线，通过在标线加设玻璃珠的方式来增加夜间行车反光，切实保障居民安全出行。 据悉，玉泉侨情枫彩带玉壶镇一期工程村庄道路是文成县中国美丽乡村建设项目内容之一，从冰心街到沿溪路玉壶镇中心幼儿园路段，用不同的颜色规划路面，路面将设置“白、黄、红”三种颜色，黄线将原本的单行道变成了双行道，规范了来往的车辆，路旁宽达2米5的红色骑行道，这一举措让居民骑行更加安全 ，也鼓励了居民绿色出行。 路面“彩衣”赢得了群众的一致好评，路变美了，车规范了，出行安全了。在完成彩色骑行道铺设后，下一步将统一规范设置停车位，放置交通标示牌。目前玉壶镇已与“hello”共享单车对接，将共享单车元素引入，让慢城骑行成为居民慢生活的享受。,19.4206657,-152.6093
文成县“建制村客车村村通”全线完工,时间：2017-09-26,来源：市公路管理局  文成县交通运输局,作者：胡悦斌 朱勇  徐佳炜, 为进一步提高城乡交通运输一体化水平，解决偏远行政村群众出行难问题。9月22日下午，文成县举行了“村村通”攻坚行动第二批建制村通车仪式。当天下午3点，在县客运中心，12辆崭新的公交班车统一发车，开往36个偏远建制村。继7月份“村村通”首批12个村完成通车后，该县又开通了25条通车线路，一次性为11个乡镇36个建制村通上公交车。,19.4206657,-152.6093
省交通工程监管局检查温州交通工程安全生产工作,时间：2017-09-26,来源：温州市交通工程质量监督局,作者：张朝者, 根据省交通工程监管局《关于组织开展全省公路水运工程桥梁支架、挂篮施工安全专项整治活动交叉检查工作的通知》文件精神，9月19日到22日，衢州市交通工程质监站副站长李士友率检查组一行3人，对温州部分交通工程进行了专项检查。,19.4206657,-152.6093
瓯江两岸交通网络建设全面推进,时间：2017-09-26,来源：市交通运输局,作者：陈旭, 9月23日下午，市交通运输局董庆华局长主持召开了关于瓯江两岸综合交通规划的研究讨论会，会议邀请了瓯江沿线开发建设指挥部副指挥、市政协叶正社副秘书长莅临指导，市规划局，市城投集团，乐清、永嘉两地政府及相关单位参加会议。 首先，董庆华局长介绍了本次研究的背景。近年来，随着浙南科技城、滨江商务区、浙南产业集聚区的蓬勃发展，温州城市东拓进程加快；随着三江商务区的发展，杭温高铁接入永嘉站，永嘉站将作为温州北站服务整个温州都市区，瓯江南北两岸的联系将更加密切。因此，构建瓯江两岸便捷的综合交通网络迫在眉睫。 会上，市交通运输局介绍了瓯江两岸的现状道路网以及公共交通情况，并提出了瓯江两岸综合交通网络的初步规划。尤其是关于跨瓯江的通道研究及选择，提出了多种方案，与会的各单位进行了意见交流。会议还对新建绕城高速乌牛互通及连接线工程前期推进作了工作部署。绕城高速乌牛互通及连接线工程北起乐清火车站，接绕城高速，南至七都北汊桥，乐清、永嘉与市区的联系将新增便捷通道。会议决定由市交投集团、乐清永嘉两地政府组成前期工作小组，共同加快推进项目。 叶正社副秘书长指出，市委市政府高度重视瓯江两岸协同发展，东瓯大桥至七都三桥间作为核心段将按照“一环两岛三重点区块多点”的发展模式，重点推进环线的休闲自行车道的建设，以及瓯江两岸亮化工程，打造夜游瓯江黄金水道，推进两岸公共交通、公共自行车、行人步道的建设，真正做到瓯江两岸同城化发展。,19.4206657,-152.6093
洞头区交通质监站“最多跑一次”送件上门,时间：2017-09-26,来源： 洞头区交通运输局,作者：曾国鹏, 9月22日，北京建工路桥工程建设有限责任公司工作人员到洞头区交通质监站咨询有关洞头区鹿西渔港港区道路工程的质量、安全生产监督申请备案的办事流程。由于该公司入驻洞头区时间短，并对相关审批事项办理流程不熟悉，因此该站工作人员在监督申请备案资料齐全的情况下，为使“企业人员不跑腿”，让“干部多跑腿”，将办理好的质量、安全生产监督通知书送至该企业。该企业工作人员表示，这是他首次在洞头区办理事务，高效的办理流程让他感到格外亲切，也表示十分的感谢。 洞头交通质监站自2017年4月将所有审批事项进驻区行政服务中心交通窗口以来，一直秉承为人民服务的思想，不断创新服务方法，延伸服务内涵，助力企业、群众办事，采取上门服务的方式，力促“最多跑一次”改革升级，得到了企业、群众的一致好评。,19.4206657,-152.6093
洞头交通质监站对大瞿岛旅游码头工程进行监督交底,时间：2017-09-26,来源：温州市交通工程质量监督局  洞头区交通运输局,作者： 徐林斌, 9月21日上午，洞头区交通质监站会同区交通工程建设指挥部到大瞿岛查看大瞿岛旅游交通码头工程的项目组建情况，并对项目进行质量和安全生产进行监督交底。路港集团有限公司、宁波宏达工程咨询有限公司相关人员参加交底会议。 会上，洞头区交通质监站就质量、安全两个方面向与会人员进行交底，在质量方面针对监督依据、监督范围、监督人员主要责任、监督计划等进行交底，明确了监督备案、试验检测、中间环节验收核查、工程技术资料等各项工作要求。在安全方面主要对法律依据、工作职责及内容、监督措施等方面进行了详细交底。 大瞿岛在洞头岛的西南部，东北距洞头区城区北岙镇9公里，岛屿面积2.33平方公里，岸线总长7.93公里，岛内举办基本已搬迁到洞头城区。交通旅游码头项目存在施工难度大、交通不便、材料运输难等情况，为此，洞头交通质监局向参建单位强调，建设工作做到科学、合理、节约、实用。一是要提高责任意识，严格项目管理，确保各项建设目标任务的顺利实现。二是要强化效能意识，实现工程进度快、内在质量优、外观形象美、安全廉洁好的建设目标。三要将质量控制措施落实到位，在精细化管理上狠下功夫，加强对项目质量的监管。四要加强基础管理，高度重视项目安全管理工作，把安全措施落实到生产的每个环节，提高项目建设管理水平。,19.4206657,-152.6093
鹿城区交通运输系统积极参与全国文明、卫生城市复评迎检活动,时间：2017-09-26,来源：鹿城区交通运输局,作者：陈慧玲, 近日，鹿城区交通运输系统到挂钩的白鹿洲网格、花柳塘社区开展全国文明、卫生城市复评迎检活动。活动中，大家身穿绿马甲，坚持以“市容整洁、景观优美、管理规范、市民满意”为目标，以主要道路为载体，对城市乱象进行全面细致地巡查，引导广大居民自觉维护环境卫生，并集中整治户外广告、流动摊担、店外经营、“牛皮癣”、乱搭乱建、违章建筑等难点问题。针对乱象问题要求当事人当场责令整改，同时还向周边住户宣传城市洁化、美化、绿化人人参与的理念。 辖区内的志愿者队伍如雨后春笋，积极参与全国文明城市、卫生城市复评迎检活动，形成了人人关注、人人参的良好氛围。,19.4206657,-152.6093
鹿城区公路管理局多举措部署四季度重点工作,时间：2017-09-26,来源：鹿城区交通运输局,作者： 陈慧玲, 鹿城公路局在上级部门的正确领导下，真抓实干、认真谋划、破难攻坚，前三季度各项工作取得阶段性成绩。近日，对前三季度的工作进行全面梳理、查漏补缺和总结，并安排部署四季度重点工作，确保完成年度工作任务。 一是抓好公路路况提升。在保证质量、安全、规范的基础上，查漏补缺，继续推进各项工程建设进度，确保目标考核任务完成。二是全力保障路域环境。继续做好“道乱占”专项整治行动及公路边三化整治，及时排查整治巩固成果，并继续开展“路卫”治超专项行动。三是加强安全生产工作。加强日常巡查和经常性检查，深化公路安全隐患排查治理工作，确保安全生产责任落实。并加强“三防”应急演练，积极做好防汛防台准备工作。四是深化综合管理工作。继续加强日常作风效能督查。深入开展信息宣传工作，争取在顺利通过年度指标的基础上实现考核成绩新突破。,19.4206657,-152.6093
市公路局三项举措开展法制宣传活动,时间：2017-09-26,来源：温州市公路局,作者：高竟翔, 9月7日至21日，市公路局根据上级法制部门的要求，深入推进“七五”普法规划，多措并举，组织开展了丰富多样的以《中华人民共和国民法总则》和《中华人民共和国行政复议法》为主要内容的法制宣传活动。 一是领导干部带头学法用法，组织局机关人员开展知识测试。此次知识测试以《中华人民共和国民法总则》和《中华人民共和国行政复议法》为主要内容，局主要领导带头，班子成员、机关各处室人员以个人自学的方式进行了学习，并全员通过测试检查学习效果。 二是进一步规范执法行为，送法下基层站队。9月7日，市公路局政策法规处赴浙闽站开展法律服务下基层和法律知识普及工作，为基层站队送上《中华人民共和国民法总则》和《中华人民共和国行政复议法》等法律书籍。 三是结合市2017社科普及周，以“科技打造智慧公路，法治点亮文明之旅”为主题，为广大市民提供公路法制宣传，现场发放《中华人民共和国民法总则》、《中华人民共和国行政复议法》、《浙江省公路路政管理条例》和《公路安全保护条例》等法律法规手册100余份，取得了良好的宣传效果。,19.4206657,-152.6093
瑞安滨海油库码头工程顺利通过交工验收,时间：2017-09-26,来源：温州市交通工程质量监督局,作者：陈亦佳," 9月21日，瑞安滨海油库码头工程建设单位中石化温州分公司组织温州市港航局、温州市交通质监局、瑞安市港航局及各参建单位，对该工程进行交工验收。验收小组通过现场踏勘、查阅相关资料，并详细听取了工程建设、设计、施工、监理等参建单位的汇报。经审议，该码头满足使用要求,同意通过交工验收。 该工程系建设规模为3000吨级成品油码头1座，泊位长度136m，设计年吞吐量50万吨，建设内容包括65 m×15 m码头平台1座，系缆墩4座，连接码头与系缆墩的人行便桥4座，20 m×10 m消防平台1座，321.21 m×8m前引桥1座，131.34 m×8m后引桥1座以及相应的配套设施。 该码头建成后，有效缓解了温州地区的成品油销售周转仓储库容不足的瓶颈问题，对提升温州市油品吞吐能力具有重要意义。",19.4206657,-152.6093
温州市交通质监局开展年度公路水运监理履约专项检查,时间：2017-09-26,来源：温州市交通工程质量监督局,作者： 许张亮, 为进一步加强全市交通建设监理市场诚信体系建设，规范交通监理市场秩序，强化项目监理办和总监的履约管理，提高监理工作质量和水平，按照年度工作计划安排，温州市交通质监局于9月18日起，对全市在建公路水运项目进行监理履约信用评价专项检查。,19.4206657,-152.6093
温州战备钢桥培训演练活动圆满完成,时间：2017-09-26,来源：温州市公路局,作者：虞翼品, 9月22日，由温州市公路管理局组织开展的战备钢桥培训演练活动圆满结束。市公路局陈亮总工及市公路安全处副处长一行指挥并检阅了此次应急演练的成果。 此次应急演练采取半机械化设施，为期一周，由来自各县（市、区）公路局和局属单位的30位技术骨干组成战备钢桥架设突击队，市公路局安全处林庆杰为队长，全体队员本着“平时服务、急时应急、战时应战”的原则，坚持每天早上7点准时训练，根据要求完成每项任务。通过此次培训演练，不仅加强了温州公路系统钢桥架设队伍建设，同时加强了温州应急保畅通突击队面对灾害发生时的应变能力。,19.4206657,-152.6093
瓯海区“村村通”客运班线通车典礼顺利举行,时间：2017-09-26,来源：温州市公路局   瓯海区交通运输局,作者：林谷, 9月22日，瓯海区“村村通”客运班线通车典礼在瓯海泽雅举行。仪式由瓯海区交通运输局副局长项敬杰主持。市交通运输局运输处副处长赵文富、瓯海区交通运输局局长金声众、泽雅镇镇长李晓以及各建制村村长等部门和各乡镇领导参加了通车典礼。,19.4206657,-152.6093
S215省道延伸线（洞头段）工程工可报告咨询会召开,时间：2017-09-26,来源：洞头交通运输局,作者： 邱艳萍, 9月21日下午，S215省道延伸线（洞头段）工程工可报告咨询会在洞头区交通运输局4楼会议室召开，出席会议的有洞头区常务副区长叶海峰以及区政协、区府办、区安监局、区发改局等相关单位。,19.4206657,-152.6093
温州港水下地形测量项目喜获中国卫星导航定位科学技术奖一等奖,时间：2017-09-26,来源：市港航局,作者：范武雷, 市港航局组织实施的温州港水下地形测量项目（温州港三大江及三大核心港区水上水下地形测绘及图形要素入库工程），荣获了中国卫星导航定位科学技术一等奖。温州港水下地形测量项目由温州市港航局2013-2014年度组织实施，该项目完成了瓯江口及洞头水域、三大江流域、部分内河等共计840余平方公里的水下地形测量与岸线调查，对水域地形地貌、岸线、跨江跨海设施、海岛（礁）分布等进行了详细的地理信息数据采集与成果入库，是市港航局在海洋测绘方面组织开展的重大项目之一，也是近年来开展的最为重大海洋水下地形测量专项项目。 中国卫星导航定位科学技术奖由中国卫星导航定位协会组织，该协会成立于1995 年，是我国卫星导航与位置服务领域的全国性行业协会。卫星导航定位科学技术奖，是国家社会力量设立科学技术奖的重要组成部分，是国内唯一卫星导航定位领域暨北斗导航领域科学技术奖。该奖项授予在我国卫星导航定位领域的科学研究、技术自主创新与开发、科技成果推广应用、高新技术产业化、重大工程建设等方面做出突出贡献的单位和个人。 本年度中国卫星导航定位科学技术奖颁奖仪式于2017年9月17日在深圳举行，“两弹一星”功勋奖章和国家最高科学技术奖获得者孙家栋、神舟号飞船总设计师戚发轫、北斗卫星导航系统总设计师杨长风少将、国家测绘地理信息局副局长闵宜仁、深圳市市长陈如桂，以及杨元喜、刘先林、魏子卿等多位院士专家与领导出席了本届颁奖仪式。,19.4206657,-152.6093
市交通运输局巡察市公路管理局工作大会召开,时间：2017-09-25,来源：温州市公路局,作者：卜寒阳, 9月21日上午，温州市交通运输局第一巡察组巡察市公路管理局工作动员大会在市公路管理局5号会议室召开。市交通运输局党委委员、市纪委驻市交通运输局纪检组组长陈劼出席会议并作了动员讲话，市公路管理局党委书记、局长连真毅主持会议。 市交通运输局第一巡察组全体成员、市公路管理局领导班子成员，局机关全体在编在岗人员，市公路路政管理支队高速公路大队、甬台温高速公路苍南超限运输检测站和市公路建设工程技术服务中心班子成员参加会议。 会上，巡察组副组长张庆春宣读了巡察文件。陈劼组长就做好本次巡察工作作了动员讲话。他强调，组织开展交通系统内巡察是落实全面从严治党的重要途径，是温州交通事业健康发展的重要保障，是自身问题整改的现实需要。一要统一思想，提高认识；二要广开门路，全面查摆问题；三要整改提高，合力推进成效。 市公路管理局党委书记、局长连真毅代表局党委汇报2016年以来的工作情况，并作了表态发言，一是提高认识，主动诚恳接受监督检查；二是积极配合，保障巡察工作顺利开展；三是注重结合，切实抓好问题整改落实。,19.4206657,-152.6093
疏港公路南塘至乐成段建设工程专项巡察汇报会召开,时间：2017-09-22,来源：乐清市交通运输局,作者：杨乐斌, 9月21日下午，在南塘镇政府，乐清市人大副主任程天青作为巡察组组长，主持召开乐清湾港区疏港公路南塘至乐成段建设工程专项巡察汇报会，市交通运输局、清江镇、南塘镇等单位负责人参加会议。,19.4206657,-152.6093
文成县港航局召开党风廉政专题学习会,时间：2017-09-22,来源：文成县港航管理局,作者：陈小敏, 9月21日下午，文成县港航管理局组织全体干部职工召开党风廉政专题学习会，会议由副局长陈海拥主持。,19.4206657,-152.6093
洞头运管 “最多跑一次”变为跑“零”次,时间：2017-09-22,来源：温州市运管局,作者： 李小刚, 9月21日，洞头北岙猴子汽车快修店负责人庄友情从交通运管工作人员手中接过机动车维修经营许可证，格外欣喜，激动地说：“5年前我申请机动车维修快修开业审批，从申请材料、上门踏勘到领取证件都要自己来回一路跑，时间起码要5天，这次我竟然能足不出户，在不到两天的时间运管就把经营许可证送到店里了，真让我意外”。 据了解，庄友情电话咨询交通窗口工作人员说：“自己想增加机动车维修的经营范围”，并询问所需材料及办理流程。然而让他意想不到的是，当天运管工作人员就走进了他的汽车快修店，不仅带去了交通运输服务指南，汽车维修申请事项的各类表格，还对办事流程进行了悉心讲解、指导填写表格、预先审核材料，并约好上门踏勘时间，进行勘验。庄友情表示：“从申请到办结，我没有跑过一次中心，这让我无比轻松”。 群众的肯定得益于洞头区委、区政府“最多跑一次”改革的落实和温州市交通运输局开展行政审批就近受理的提效要求，洞头区交通审批窗口服务延伸到门到户，将“群众跑”变成“干部跑”，大力推行审批业务就近受理。同时，运管工作人员通过线上线下相融合，让“数据多跑路”和 “干部多跑腿”，让许可实现全程代办，让审批无障碍，服务零距离。通过推广“快递送达”、送证上门等多项举措，提高“跑一次”或“零上门”事项的数量和比例，有效减少群众跑腿次数，降低办事成本，逐步迈向“零跑腿”。 据悉，今年以来，洞头交通审批窗口以群众利益为导向，梳理权力事项27项，通过自我加压，27项事项已全部实现“最多跑一次”，其中13个事项做到“跑零次”，占全部事项的48.1%。全年预计90%的审批事项实现网上办理，群众、企业办件将从改革前的平均跑2次降为0.125次，平均时限比改革前减少3天。,19.4206657,-152.6093
全省出租汽车驾驶员职业技能竞赛温州选拔赛成功举行,时间：2017-09-22,来源：温州市运管局,作者：张伟光, 为进一步提高温州市出租汽车驾驶员队伍服务水平和职业技能，加强全市出租车行业从业人员的交流，2017年9月20日，由温州市道路运输管理局主办，温州交通技术学校协办的全省出租汽车驾驶员职业技能竞赛温州选拔赛，在温州交通技术学校校区成功举办。 本次选拔赛共吸引了瑞安、苍南、乐清、平阳、永嘉以及市区交运、博爱、开通、温鹿、微型、德士、国际大酒店等十二支代表队、共计24名驾驶员参加。比赛项目是根据省竞赛的要求，并结合温州的实际特点来设置，项目分别为理论知识、出租车驾驶员服务规范操作，如计价器的规范使用、线路选择、沟通能力和文明用语等内容等，以及汽车安检、更换轮胎、应急灭火、倒车移位、倒入S弯道及调头、礼让斑马线、靶心定点平稳停车、道路平稳驾驶等内容。 在赛场上，平日奔波劳碌在路上的“的哥”们全力以赴投入竞赛各个环节，认真的享受比赛。各代表队和全体“的哥”们发扬友谊第一、比赛第二的风格，经过一天紧张而激烈的角逐，微型出租代表队、开通出租代表队、国际大酒店出租代表队分别获得团体第一名、第二名、第三名，而来自开通公司的曹治春、微型公司的金科夫、微型公司的张建文分别获得个人第一名、第二名、第三名。当前正值温州市全国文明城市复评迎检工作的关键阶段，  通过此次选拔赛，不仅检验了温州市出租车驾驶员的职业技能水平，展示了他们的精神风貌，而且激发了广大驾驶员开文明车、说文明语，树立诚信经营服务理念，更充分展现温州市出租车行业的精湛技艺和文明素养，以实际行动助力“文明城市复评迎检”工作。,19.4206657,-152.6093
温州市交通运输局董庆华局长调研汽车维修企业,时间：2017-09-22,来源：温州市运管局,作者：姚武, 9月20日下午，温州市交通运输局董庆华局长带队到汽车维修企业进行调研。市交通运输局运输处李克处长，市运管局陈代庆副局长陪同调研。 董庆华局长一行来到宏顺汽车修理厂，实地查看了企业车间的实际运作情况，了解到该汽车维修企业发展过程中遇到的难题，当场进行协调解决。调研过程中，董庆华局长十分关心汽车维修企业的未来发展方向。他指出，汽车维修行业想要长远发展，除了要找出自身存在的不足外，还要比对先进，补齐短板。同时，就汽车维修企业的整体诚信情况，强调要推进行业诚信建设，树立汽车维修行业的良好行业形象。,19.4206657,-152.6093
